{
  "$schema":"https://json-schema.org/draft/2020-12/schema","$id":"https://agent-memory.local/schemas/evidence/v1/staging-game-day-input.schema.json","title":"Agent Memory P10.3-A staging game-day input","type":"object","additionalProperties":false,
  "required":["schema","classification","environment","bundle_id","review_version","inventory_id","inventory_receipt_sha256","plan_id","plan_receipt_sha256","change_id","change_receipt_sha256","release_id","release_receipt_sha256","operations_security_review_sha256","generated_at","ready","drills","bundle_checks"],
  "properties":{"schema":{"const":"agent-memory-staging-game-day-input-v1"},"classification":{"const":"staging_external"},"environment":{"const":"staging"},"bundle_id":{"$ref":"#/$defs/opaque"},"review_version":{"$ref":"#/$defs/opaque"},"inventory_id":{"$ref":"#/$defs/opaque"},"inventory_receipt_sha256":{"$ref":"#/$defs/digest"},"plan_id":{"$ref":"#/$defs/opaque"},"plan_receipt_sha256":{"$ref":"#/$defs/digest"},"change_id":{"$ref":"#/$defs/opaque"},"change_receipt_sha256":{"$ref":"#/$defs/digest"},"release_id":{"$ref":"#/$defs/opaque"},"release_receipt_sha256":{"$ref":"#/$defs/digest"},"operations_security_review_sha256":{"$ref":"#/$defs/digest"},"generated_at":{"type":"string","format":"date-time"},"ready":{"type":"boolean"},"drills":{"type":"array","minItems":7,"maxItems":7,"items":{"$ref":"#/$defs/drill"}},"bundle_checks":{"type":"array","minItems":8,"maxItems":8,"items":{"$ref":"#/$defs/check"}}},
  "$defs":{"digest":{"type":"string","pattern":"^[a-f0-9]{64}$"},"opaque":{"type":"string","pattern":"^[A-Za-z0-9][A-Za-z0-9._:+-]{0,127}$"},"count":{"type":"integer","minimum":0,"maximum":1000000},"outcome":{"enum":["passed","failed","inconclusive"]},
    "check":{"type":"object","additionalProperties":false,"required":["id","outcome","evidence_sha256"],"properties":{"id":{"enum":["failure_injection_or_observation_verified","installed_alert_delivery_verified","accountable_responder_acknowledged","containment_verified","service_recovery_verified","immutable_audit_retained","committed_state_and_rpo_preserved","queue_replay_idempotency_verified","component_failover_or_replacement_verified","integration_degradation_or_disabled_state_verified","credential_revoked_and_post_revoke_denied","cross_tenant_existence_and_content_signal_absent","deletion_revocation_and_retry_visibility_verified","platform_release_binding_verified","required_scenario_coverage_complete","component_subject_coverage_complete","integration_state_reconciliation_complete","alert_and_response_checks_passed","approved_recovery_targets_met","immutable_drill_artifacts_complete","operations_security_review_complete"]},"outcome":{"$ref":"#/$defs/outcome"},"evidence_sha256":{"$ref":"#/$defs/digest"}}},
    "drill":{"type":"object","additionalProperties":false,"required":["id","drill_id","target_policy_version","target_seconds","target_decision_sha256","report_sha256","evidence_manifest_sha256","started_at","detected_at","alerted_at","acknowledged_at","contained_at","recovered_at","completed_at","subject_count","enabled_subject_count","exercised_subject_count","disabled_state_verified_count","checks"],"properties":{"id":{"enum":["database_failover","queue_backlog","self_managed_component_failure","external_integration_outage","credential_leak","cross_tenant_attempt","incomplete_deletion"]},"drill_id":{"$ref":"#/$defs/opaque"},"target_policy_version":{"$ref":"#/$defs/opaque"},"target_seconds":{"type":"integer","minimum":1,"maximum":86400},"target_decision_sha256":{"$ref":"#/$defs/digest"},"report_sha256":{"$ref":"#/$defs/digest"},"evidence_manifest_sha256":{"$ref":"#/$defs/digest"},"started_at":{"type":"string","format":"date-time"},"detected_at":{"type":"string","format":"date-time"},"alerted_at":{"type":"string","format":"date-time"},"acknowledged_at":{"type":"string","format":"date-time"},"contained_at":{"type":"string","format":"date-time"},"recovered_at":{"type":"string","format":"date-time"},"completed_at":{"type":"string","format":"date-time"},"subject_count":{"$ref":"#/$defs/count"},"enabled_subject_count":{"$ref":"#/$defs/count"},"exercised_subject_count":{"$ref":"#/$defs/count"},"disabled_state_verified_count":{"$ref":"#/$defs/count"},"checks":{"type":"array","minItems":7,"maxItems":7,"items":{"$ref":"#/$defs/check"}}}}
  }
}
