{
  "schema":"agent-memory-staging-game-day-input-v1","classification":"staging_external","environment":"staging","bundle_id":"game-day-bundle-2026","review_version":"ops-security-v1",
  "inventory_id":"staging-inventory","inventory_receipt_sha256":"aaaaaaaaaaaaaaaaaaaaaaaaaaaaaaaaaaaaaaaaaaaaaaaaaaaaaaaaaaaaaaaa","plan_id":"staging-plan","plan_receipt_sha256":"bbbbbbbbbbbbbbbbbbbbbbbbbbbbbbbbbbbbbbbbbbbbbbbbbbbbbbbbbbbbbbbb","change_id":"staging-change","change_receipt_sha256":"cccccccccccccccccccccccccccccccccccccccccccccccccccccccccccccccc","release_id":"staging-release","release_receipt_sha256":"dddddddddddddddddddddddddddddddddddddddddddddddddddddddddddddddd","operations_security_review_sha256":"eeeeeeeeeeeeeeeeeeeeeeeeeeeeeeeeeeeeeeeeeeeeeeeeeeeeeeeeeeeeeeee","generated_at":"2026-08-10T19:00:00Z","ready":true,
  "drills":[
    {"id":"database_failover","drill_id":"drill-database","target_policy_version":"targets-v1","target_seconds":3600,"target_decision_sha256":"1111111111111111111111111111111111111111111111111111111111111111","report_sha256":"2222222222222222222222222222222222222222222222222222222222222222","evidence_manifest_sha256":"3333333333333333333333333333333333333333333333333333333333333333","started_at":"2026-08-10T08:00:00Z","detected_at":"2026-08-10T08:01:00Z","alerted_at":"2026-08-10T08:02:00Z","acknowledged_at":"2026-08-10T08:03:00Z","contained_at":"2026-08-10T08:05:00Z","recovered_at":"2026-08-10T08:20:00Z","completed_at":"2026-08-10T08:25:00Z","subject_count":1,"enabled_subject_count":0,"exercised_subject_count":1,"disabled_state_verified_count":0,"checks":[{"id":"failure_injection_or_observation_verified","outcome":"passed","evidence_sha256":"4444444444444444444444444444444444444444444444444444444444444444"},{"id":"installed_alert_delivery_verified","outcome":"passed","evidence_sha256":"4444444444444444444444444444444444444444444444444444444444444444"},{"id":"accountable_responder_acknowledged","outcome":"passed","evidence_sha256":"4444444444444444444444444444444444444444444444444444444444444444"},{"id":"containment_verified","outcome":"passed","evidence_sha256":"4444444444444444444444444444444444444444444444444444444444444444"},{"id":"service_recovery_verified","outcome":"passed","evidence_sha256":"4444444444444444444444444444444444444444444444444444444444444444"},{"id":"immutable_audit_retained","outcome":"passed","evidence_sha256":"4444444444444444444444444444444444444444444444444444444444444444"},{"id":"committed_state_and_rpo_preserved","outcome":"passed","evidence_sha256":"4444444444444444444444444444444444444444444444444444444444444444"}]},
    {"id":"queue_backlog","drill_id":"drill-queue","target_policy_version":"targets-v1","target_seconds":3600,"target_decision_sha256":"1111111111111111111111111111111111111111111111111111111111111111","report_sha256":"2222222222222222222222222222222222222222222222222222222222222222","evidence_manifest_sha256":"3333333333333333333333333333333333333333333333333333333333333333","started_at":"2026-08-10T09:00:00Z","detected_at":"2026-08-10T09:01:00Z","alerted_at":"2026-08-10T09:02:00Z","acknowledged_at":"2026-08-10T09:03:00Z","contained_at":"2026-08-10T09:05:00Z","recovered_at":"2026-08-10T09:20:00Z","completed_at":"2026-08-10T09:25:00Z","subject_count":1,"enabled_subject_count":0,"exercised_subject_count":1,"disabled_state_verified_count":0,"checks":[{"id":"failure_injection_or_observation_verified","outcome":"passed","evidence_sha256":"4444444444444444444444444444444444444444444444444444444444444444"},{"id":"installed_alert_delivery_verified","outcome":"passed","evidence_sha256":"4444444444444444444444444444444444444444444444444444444444444444"},{"id":"accountable_responder_acknowledged","outcome":"passed","evidence_sha256":"4444444444444444444444444444444444444444444444444444444444444444"},{"id":"containment_verified","outcome":"passed","evidence_sha256":"4444444444444444444444444444444444444444444444444444444444444444"},{"id":"service_recovery_verified","outcome":"passed","evidence_sha256":"4444444444444444444444444444444444444444444444444444444444444444"},{"id":"immutable_audit_retained","outcome":"passed","evidence_sha256":"4444444444444444444444444444444444444444444444444444444444444444"},{"id":"queue_replay_idempotency_verified","outcome":"passed","evidence_sha256":"4444444444444444444444444444444444444444444444444444444444444444"}]},
    {"id":"self_managed_component_failure","drill_id":"drill-components","target_policy_version":"targets-v1","target_seconds":3600,"target_decision_sha256":"1111111111111111111111111111111111111111111111111111111111111111","report_sha256":"2222222222222222222222222222222222222222222222222222222222222222","evidence_manifest_sha256":"3333333333333333333333333333333333333333333333333333333333333333","started_at":"2026-08-10T10:00:00Z","detected_at":"2026-08-10T10:01:00Z","alerted_at":"2026-08-10T10:02:00Z","acknowledged_at":"2026-08-10T10:03:00Z","contained_at":"2026-08-10T10:05:00Z","recovered_at":"2026-08-10T10:20:00Z","completed_at":"2026-08-10T10:25:00Z","subject_count":8,"enabled_subject_count":0,"exercised_subject_count":8,"disabled_state_verified_count":0,"checks":[{"id":"failure_injection_or_observation_verified","outcome":"passed","evidence_sha256":"4444444444444444444444444444444444444444444444444444444444444444"},{"id":"installed_alert_delivery_verified","outcome":"passed","evidence_sha256":"4444444444444444444444444444444444444444444444444444444444444444"},{"id":"accountable_responder_acknowledged","outcome":"passed","evidence_sha256":"4444444444444444444444444444444444444444444444444444444444444444"},{"id":"containment_verified","outcome":"passed","evidence_sha256":"4444444444444444444444444444444444444444444444444444444444444444"},{"id":"service_recovery_verified","outcome":"passed","evidence_sha256":"4444444444444444444444444444444444444444444444444444444444444444"},{"id":"immutable_audit_retained","outcome":"passed","evidence_sha256":"4444444444444444444444444444444444444444444444444444444444444444"},{"id":"component_failover_or_replacement_verified","outcome":"passed","evidence_sha256":"4444444444444444444444444444444444444444444444444444444444444444"}]},
    {"id":"external_integration_outage","drill_id":"drill-integrations","target_policy_version":"targets-v1","target_seconds":3600,"target_decision_sha256":"1111111111111111111111111111111111111111111111111111111111111111","report_sha256":"2222222222222222222222222222222222222222222222222222222222222222","evidence_manifest_sha256":"3333333333333333333333333333333333333333333333333333333333333333","started_at":"2026-08-10T11:00:00Z","detected_at":"2026-08-10T11:01:00Z","alerted_at":"2026-08-10T11:02:00Z","acknowledged_at":"2026-08-10T11:03:00Z","contained_at":"2026-08-10T11:05:00Z","recovered_at":"2026-08-10T11:20:00Z","completed_at":"2026-08-10T11:25:00Z","subject_count":3,"enabled_subject_count":0,"exercised_subject_count":0,"disabled_state_verified_count":3,"checks":[{"id":"failure_injection_or_observation_verified","outcome":"passed","evidence_sha256":"4444444444444444444444444444444444444444444444444444444444444444"},{"id":"installed_alert_delivery_verified","outcome":"passed","evidence_sha256":"4444444444444444444444444444444444444444444444444444444444444444"},{"id":"accountable_responder_acknowledged","outcome":"passed","evidence_sha256":"4444444444444444444444444444444444444444444444444444444444444444"},{"id":"containment_verified","outcome":"passed","evidence_sha256":"4444444444444444444444444444444444444444444444444444444444444444"},{"id":"service_recovery_verified","outcome":"passed","evidence_sha256":"4444444444444444444444444444444444444444444444444444444444444444"},{"id":"immutable_audit_retained","outcome":"passed","evidence_sha256":"4444444444444444444444444444444444444444444444444444444444444444"},{"id":"integration_degradation_or_disabled_state_verified","outcome":"passed","evidence_sha256":"4444444444444444444444444444444444444444444444444444444444444444"}]},
    {"id":"credential_leak","drill_id":"drill-credential","target_policy_version":"targets-v1","target_seconds":3600,"target_decision_sha256":"1111111111111111111111111111111111111111111111111111111111111111","report_sha256":"2222222222222222222222222222222222222222222222222222222222222222","evidence_manifest_sha256":"3333333333333333333333333333333333333333333333333333333333333333","started_at":"2026-08-10T12:00:00Z","detected_at":"2026-08-10T12:01:00Z","alerted_at":"2026-08-10T12:02:00Z","acknowledged_at":"2026-08-10T12:03:00Z","contained_at":"2026-08-10T12:05:00Z","recovered_at":"2026-08-10T12:20:00Z","completed_at":"2026-08-10T12:25:00Z","subject_count":1,"enabled_subject_count":0,"exercised_subject_count":1,"disabled_state_verified_count":0,"checks":[{"id":"failure_injection_or_observation_verified","outcome":"passed","evidence_sha256":"4444444444444444444444444444444444444444444444444444444444444444"},{"id":"installed_alert_delivery_verified","outcome":"passed","evidence_sha256":"4444444444444444444444444444444444444444444444444444444444444444"},{"id":"accountable_responder_acknowledged","outcome":"passed","evidence_sha256":"4444444444444444444444444444444444444444444444444444444444444444"},{"id":"containment_verified","outcome":"passed","evidence_sha256":"4444444444444444444444444444444444444444444444444444444444444444"},{"id":"service_recovery_verified","outcome":"passed","evidence_sha256":"4444444444444444444444444444444444444444444444444444444444444444"},{"id":"immutable_audit_retained","outcome":"passed","evidence_sha256":"4444444444444444444444444444444444444444444444444444444444444444"},{"id":"credential_revoked_and_post_revoke_denied","outcome":"passed","evidence_sha256":"4444444444444444444444444444444444444444444444444444444444444444"}]},